id,user_id,bio,experience_years,hours_rate,is_verified,is_available,slta_license_id,slta_license_expiry,nic_number,created_at
110,200,"Expert guide specializing in cultural and historical tours across Sri Lanka. Passionate about sharing the rich heritage of the island with travelers from around the world. Fluent in multiple languages and certified by SLTDA.",8,2500.00,true,true,SLTA2016001,2026-12-31 23:59:59,199012345678,2024-01-10 09:00:00
111,201,"Adventure tour specialist with extensive experience in wildlife safaris, hiking expeditions, and eco-tourism. Deep knowledge of Sri Lanka's national parks and biodiversity. Certified wildlife guide.",6,2800.00,true,true,SLTA2018002,2026-12-31 23:59:59,199112345679,2024-01-11 09:00:00
112,202,"Coastal and beach tour expert covering the entire southern and western coastlines. Specializing in water sports, beach activities, and coastal heritage sites. Excellent communication skills.",10,3000.00,true,true,SLTA2014003,2026-12-31 23:59:59,198912345680,2024-01-12 09:00:00
113,203,"Hill country and tea plantation specialist. Expertise in Nuwara Eliya, Ella, and the central highlands. Focus on nature trails, tea factory tours, and mountain trekking. Warm and friendly personality.",7,2600.00,true,true,SLTA2017004,2026-12-31 23:59:59,199212345681,2024-01-13 09:00:00
114,204,"Ancient cities and UNESCO World Heritage site expert. Specializing in Sigiriya, Polonnaruwa, Anuradhapura, and Dambulla. Deep knowledge of Buddhist history and archaeology. Professional and knowledgeable.",12,3500.00,true,true,SLTA2012005,2026-12-31 23:59:59,198712345682,2024-01-14 09:00:00
